{
  "schema_version": "0.1.0",
  "session_id": "session-demo-001",
  "scenario_id": "smoke_inhalation_room_v0",
  "event_id": "event-001",
  "timestamp": "2026-06-22T09:00:00Z",
  "actor_id": "trainee-001",
  "action_type": "assess_scene",
  "payload": {
    "observation": "visible smoke reported in one room"
  },
  "sequence_number": 1
}
